{
  "schema_version": "1.0.0",
  "work_order_id": "WO-20270301-0001",
  "status": "DISPATCHED",
  "priority": null,
  "created_t_s": 10560,
  "created_at": "2027-03-01T02:56:00Z",
  "updated_t_s": 10560,
  "updated_at": "2027-03-01T02:56:00Z",
  "robot": {
    "robot_id": "P2-02",
    "robot_type": "P2_TRANSPORT",
    "mission_id": "M-HAUL-B",
    "location": {
      "zone": "HAUL_ROUTE_2",
      "x_m": null,
      "y_m": null
    },
    "status_at_creation": "ACTIVE"
  },
  "suspected_failure": {
    "fault_mode": "bearing_wear",
    "label": "Wheel hub bearing wear",
    "component": "wheel_fl_drive",
    "subsystem": "MOBILITY",
    "confidence": 0.78,
    "description": "Worn or regolith-contaminated hub bearing adds friction torque. The motor draws more current to overcome it, the wheel slows, and the friction itself heats the hub directly."
  },
  "severity": "CRITICAL",
  "predicted_ttf_s": 3300,
  "predicted_ttf_interval_s": {
    "low": 2460,
    "high": 4476,
    "confidence_level": 0.8
  },
  "predicted_failure_t_s": 13860,
  "predicted_failure_at": "2027-03-01T03:51:00Z",
  "recommended_action": {
    "code": "REPLACE_HUB_BEARING",
    "text": "Stop driving as soon as safe. Go to P5. Replace hub bearing on the affected wheel; inspect seals and gearbox for regolith ingress.",
    "est_repair_s": 10800,
    "parts": [
      "hub bearing",
      "hub seal kit"
    ]
  },
  "garage": {
    "garage_id": "P5-GARAGE-1",
    "bay_id": "BAY-1"
  },
  "evidence": {
    "prediction_id": "PR-000001",
    "anomaly_ids": [],
    "summary": "Front-left drive is running hotter than its current explains (thermal residual about +10 degC) while its current is rising and its speed falling; the front-right drive in the same conditions is normal. That pattern matches hub bearing wear, not wheel drag (drag would leave the thermal residual near zero). Linear trend reaches the CRITICAL temperature limit in about 55 min.",
    "window": {
      "robot_id": "P2-02",
      "start_t_s": 6960,
      "end_t_s": 10560,
      "channels": [
        "wheel_fl_temp_c",
        "wheel_fl_current_a",
        "wheel_fl_speed_rads",
        "wheel_fr_temp_c"
      ],
      "source": "telemetry.parquet"
    },
    "channels": [
      {
        "channel": "wheel_fl_temp_c",
        "label": "Front-left drive temperature",
        "units": "degC",
        "baseline": 33.76,
        "warning_limit": 48.76,
        "critical_limit": 63.76,
        "points": [
          [
            6960,
            36.75
          ],
          [
            7020,
            36.91
          ],
          [
            7080,
            35.24
          ],
          [
            7140,
            33.86
          ],
          [
            7200,
            32.67
          ],
          [
            7260,
            31.33
          ],
          [
            7320,
            30.13
          ],
          [
            7380,
            29.06
          ],
          [
            7440,
            30.92
          ],
          [
            7500,
            32.6
          ],
          [
            7560,
            34.48
          ],
          [
            7620,
            35.64
          ],
          [
            7680,
            36.78
          ],
          [
            7740,
            37.93
          ],
          [
            7800,
            39.02
          ],
          [
            7860,
            40.24
          ],
          [
            7920,
            40.91
          ],
          [
            7980,
            42.14
          ],
          [
            8040,
            42.63
          ],
          [
            8100,
            43.46
          ],
          [
            8160,
            44.08
          ],
          [
            8220,
            44.28
          ],
          [
            8280,
            45.33
          ],
          [
            8340,
            45.65
          ],
          [
            8400,
            46.33
          ],
          [
            8460,
            46.57
          ],
          [
            8520,
            47.21
          ],
          [
            8580,
            47.94
          ],
          [
            8640,
            48.27
          ],
          [
            8700,
            48.63
          ],
          [
            8760,
            48.61
          ],
          [
            8820,
            49.53
          ],
          [
            8880,
            49.58
          ],
          [
            8940,
            46.72
          ],
          [
            9000,
            44.38
          ],
          [
            9060,
            41.69
          ],
          [
            9120,
            40.16
          ],
          [
            9180,
            40.46
          ],
          [
            9240,
            40.65
          ],
          [
            9300,
            41.23
          ],
          [
            9360,
            42.03
          ],
          [
            9420,
            41.88
          ],
          [
            9480,
            42.4
          ],
          [
            9540,
            43.01
          ],
          [
            9600,
            43.42
          ],
          [
            9660,
            44.19
          ],
          [
            9720,
            43.97
          ],
          [
            9780,
            44.3
          ],
          [
            9840,
            45.11
          ],
          [
            9900,
            45.3
          ],
          [
            9960,
            45.63
          ],
          [
            10020,
            45.69
          ],
          [
            10080,
            46.38
          ],
          [
            10140,
            46.32
          ],
          [
            10200,
            46.89
          ],
          [
            10260,
            47.18
          ],
          [
            10320,
            47.13
          ],
          [
            10380,
            47.64
          ],
          [
            10440,
            48.17
          ],
          [
            10500,
            48.47
          ],
          [
            10560,
            48.59
          ]
        ]
      },
      {
        "channel": "wheel_fl_current_a",
        "label": "Front-left drive motor current",
        "units": "A",
        "baseline": 3.29,
        "warning_limit": 4.29,
        "critical_limit": 5.29,
        "points": [
          [
            6960,
            3.522
          ],
          [
            7020,
            3.436
          ],
          [
            7080,
            0.006
          ],
          [
            7140,
            0.001
          ],
          [
            7200,
            0.008
          ],
          [
            7260,
            0.009
          ],
          [
            7320,
            0.001
          ],
          [
            7380,
            0.007
          ],
          [
            7440,
            5.005
          ],
          [
            7500,
            4.963
          ],
          [
            7560,
            4.968
          ],
          [
            7620,
            4.919
          ],
          [
            7680,
            5.067
          ],
          [
            7740,
            4.963
          ],
          [
            7800,
            5.096
          ],
          [
            7860,
            5.054
          ],
          [
            7920,
            5.002
          ],
          [
            7980,
            5.065
          ],
          [
            8040,
            5.075
          ],
          [
            8100,
            5.031
          ],
          [
            8160,
            5.051
          ],
          [
            8220,
            5.086
          ],
          [
            8280,
            5.044
          ],
          [
            8340,
            5.132
          ],
          [
            8400,
            5.154
          ],
          [
            8460,
            5.158
          ],
          [
            8520,
            5.147
          ],
          [
            8580,
            5.151
          ],
          [
            8640,
            5.165
          ],
          [
            8700,
            5.103
          ],
          [
            8760,
            5.175
          ],
          [
            8820,
            5.155
          ],
          [
            8880,
            5.151
          ],
          [
            8940,
            0.007
          ],
          [
            9000,
            0.009
          ],
          [
            9060,
            0.01
          ],
          [
            9120,
            0.003
          ],
          [
            9180,
            3.748
          ],
          [
            9240,
            3.689
          ],
          [
            9300,
            3.695
          ],
          [
            9360,
            3.785
          ],
          [
            9420,
            3.765
          ],
          [
            9480,
            3.715
          ],
          [
            9540,
            3.783
          ],
          [
            9600,
            3.797
          ],
          [
            9660,
            3.86
          ],
          [
            9720,
            3.806
          ],
          [
            9780,
            3.702
          ],
          [
            9840,
            3.698
          ],
          [
            9900,
            3.794
          ],
          [
            9960,
            3.855
          ],
          [
            10020,
            3.787
          ],
          [
            10080,
            3.873
          ],
          [
            10140,
            3.943
          ],
          [
            10200,
            3.917
          ],
          [
            10260,
            3.863
          ],
          [
            10320,
            3.903
          ],
          [
            10380,
            3.809
          ],